{
  "$schema": "https://json-schema.org/draft/2020-12/schema",
  "$id": "trip.schema.json",
  "title": "Trip",
  "description": "A trip config rendered by the generic trip engine (app.html). Every user-visible string is a localized object keyed by language code; the trip's languages array declares which keys must be present.",
  "type": "object",
  "required": ["id", "title", "languages", "defaultLanguage", "segments"],
  "additionalProperties": false,
  "properties": {
    "id": {
      "type": "string",
      "pattern": "^[a-z0-9][a-z0-9-]*$",
      "description": "URL-safe id, matches the filename (trips/<id>.json) and manifest entry"
    },
    "title": { "$ref": "#/$defs/localized" },
    "eyebrow": {
      "$ref": "#/$defs/localized",
      "description": "Small label above the segment title in the hero, e.g. 'April 2026'"
    },
    "languages": {
      "type": "array",
      "items": { "type": "string", "minLength": 2 },
      "minItems": 1,
      "uniqueItems": true,
      "description": "UI hides the language toggle when only one language"
    },
    "defaultLanguage": { "type": "string" },
    "cover": {
      "type": "string",
      "description": "Optional emoji shown on the trip picker card, e.g. \"🏛️\""
    },
    "currency": {
      "type": "string",
      "pattern": "^[A-Z]{3}$",
      "description": "ISO 4217 code for the trip's single currency (e.g. \"GBP\"), used to format every block cost and the budget. When absent, money figures render as plain numbers."
    },
    "budget": {
      "type": "number",
      "exclusiveMinimum": 0,
      "description": "Optional total spending target for the trip, in `currency`; drives the header budget progress bar (Phase 6 budget)."
    },
    "locales": {
      "type": "object",
      "additionalProperties": { "type": "string" },
      "description": "Optional BCP 47 locale per language code for date formatting, e.g. {\"en\": \"en-GB\"}; defaults to the language code itself"
    },
    "home": {
      "type": "object",
      "required": ["name"],
      "additionalProperties": false,
      "properties": {
        "name": { "type": "string" },
        "postcode": { "type": "string" },
        "lat": { "type": "number" },
        "lon": { "type": "number" }
      }
    },
    "tags": {
      "description": "Tag vocabulary: block tag keys resolve here for label + chip style",
      "type": "object",
      "additionalProperties": {
        "type": "object",
        "required": ["label"],
        "additionalProperties": false,
        "properties": {
          "label": { "$ref": "#/$defs/localized" },
          "style": {
            "enum": ["sight", "food", "birthday", "booking", "logistics", "fullday"],
            "description": "Named chip style mapped to colors by the engine"
          }
        }
      }
    },
    "segments": {
      "type": "array",
      "minItems": 1,
      "items": { "$ref": "#/$defs/segment" }
    }
  },
  "$defs": {
    "localized": {
      "type": "object",
      "minProperties": 1,
      "additionalProperties": { "type": "string" },
      "description": "Map of language code to string, e.g. {\"en\": ..., \"pt\": ...}"
    },
    "guideImage": {
      "description": "A reference photo attached to a guide or a don't-miss item. Set file or url (or both; url wins).",
      "type": "object",
      "additionalProperties": false,
      "anyOf": [{ "required": ["file"] }, { "required": ["url"] }],
      "properties": {
        "file": {
          "type": "string",
          "minLength": 1,
          "description": "Wikimedia Commons file name without the 'File:' prefix"
        },
        "url": {
          "type": "string",
          "pattern": "^https://",
          "description": "Direct https image URL, used when file is absent"
        },
        "credit": { "type": "string", "description": "Photographer or author" },
        "license": { "type": "string", "description": "License short name, e.g. 'CC BY-SA 4.0'" }
      }
    },
    "segment": {
      "type": "object",
      "required": ["id", "title", "plans"],
      "additionalProperties": false,
      "properties": {
        "id": { "type": "string", "pattern": "^[a-z0-9][a-z0-9_-]*$" },
        "title": { "$ref": "#/$defs/localized" },
        "subtitle": { "$ref": "#/$defs/localized" },
        "theme": {
          "type": "string",
          "description": "Named theme resolved to CSS custom properties by the engine, e.g. 'tartan', 'navy'"
        },
        "themeColors": {
          "type": "object",
          "additionalProperties": false,
          "description": "Custom colors overriding the named theme; hex strings",
          "properties": {
            "heroBg": { "type": "string", "pattern": "^#[0-9a-fA-F]{3,8}$" },
            "accent": { "type": "string", "pattern": "^#[0-9a-fA-F]{3,8}$" },
            "eyebrow": { "type": "string", "pattern": "^#[0-9a-fA-F]{3,8}$" }
          }
        },
        "weather": {
          "type": "object",
          "required": ["lat", "lon", "granularity"],
          "additionalProperties": false,
          "properties": {
            "lat": { "type": "number" },
            "lon": { "type": "number" },
            "granularity": { "enum": ["hourly", "daily"] },
            "timezone": { "type": "string" }
          }
        },
        "footer": { "$ref": "#/$defs/localized" },
        "defaultPlan": {
          "type": "string",
          "description": "Plan id selected on load; defaults to the first plan"
        },
        "plans": {
          "type": "array",
          "minItems": 1,
          "items": { "$ref": "#/$defs/plan" },
          "description": "UI shows plan tabs only when more than one plan"
        }
      }
    },
    "plan": {
      "type": "object",
      "required": ["id", "days"],
      "additionalProperties": false,
      "properties": {
        "id": { "type": "string", "pattern": "^[a-z0-9][a-z0-9_-]*$" },
        "label": { "$ref": "#/$defs/localized" },
        "diffLabels": {
          "description": "Prefixes for block diff annotations, shown only on this plan",
          "type": "object",
          "additionalProperties": false,
          "properties": {
            "added": { "$ref": "#/$defs/localized" },
            "changed": { "$ref": "#/$defs/localized" },
            "kept": { "$ref": "#/$defs/localized" }
          }
        },
        "days": {
          "type": "array",
          "minItems": 1,
          "items": { "$ref": "#/$defs/day" }
        }
      }
    },
    "entityId": {
      "type": "string",
      "pattern": "^[a-z0-9]{8,32}$",
      "description": "Stable identity minted on write, so photo placement survives re-dating and reordering. Optional: documents written before this existed stay valid and gain one on their next save."
    },
    "day": {
      "type": "object",
      "required": ["date", "title", "blocks"],
      "additionalProperties": false,
      "properties": {
        "id": { "$ref": "#/$defs/entityId" },
        "date": { "type": "string", "format": "date", "pattern": "^\\d{4}-\\d{2}-\\d{2}$" },
        "title": { "$ref": "#/$defs/localized" },
        "note": { "$ref": "#/$defs/localized" },
        "routeMode": {
          "enum": ["walking", "driving", "transit", "bicycling"],
          "description": "travelmode appended to the Google Maps day-route URL"
        },
        "banner": {
          "$ref": "#/$defs/localized",
          "description": "Celebration strip under the day header; presence also marks the day-nav pip"
        },
        "kmTotal": {
          "type": "number",
          "exclusiveMinimum": 0,
          "description": "Explicit walking-distance total for the day header; overrides the sum of block km"
        },
        "staticWeather": {
          "description": "Displayed instead of live weather for past trips",
          "type": "object",
          "required": ["hi", "lo"],
          "additionalProperties": false,
          "properties": {
            "hi": { "type": "number" },
            "lo": { "type": "number" },
            "emoji": { "type": "string" }
          }
        },
        "blocks": {
          "type": "array",
          "minItems": 1,
          "items": { "$ref": "#/$defs/block" }
        }
      }
    },
    "block": {
      "type": "object",
      "required": ["time", "title"],
      "additionalProperties": false,
      "properties": {
        "id": { "$ref": "#/$defs/entityId" },
        "time": { "type": "string" },
        "dotColor": { "type": "string", "pattern": "^#[0-9a-fA-F]{3,8}$" },
        "title": { "$ref": "#/$defs/localized" },
        "tags": {
          "type": "array",
          "items": { "type": "string" },
          "description": "Keys into the trip-level tags vocabulary"
        },
        "description": { "$ref": "#/$defs/localized" },
        "mapsUrl": { "type": "string", "format": "uri", "pattern": "^https?://" },
        "links": {
          "description": "External booking/reservation links (hotel confirmations, restaurant reservations, tickets). Rendered as provider-labelled pills; the label is auto-derived from the URL host when omitted.",
          "type": "array",
          "items": {
            "type": "object",
            "required": ["url"],
            "additionalProperties": false,
            "properties": {
              "url": { "type": "string", "format": "uri", "pattern": "^https?://" },
              "label": { "type": "string", "description": "Optional display label; falls back to the provider name derived from the URL host." }
            }
          }
        },
        "km": { "type": "number", "exclusiveMinimum": 0 },
        "cost": {
          "description": "Optional estimated cost of this stop, in the trip's `currency`. Summed into day, plan and whole-trip totals for the budget bar (Phase 6 budget).",
          "type": "object",
          "required": ["amount"],
          "additionalProperties": false,
          "properties": {
            "amount": { "type": "number", "exclusiveMinimum": 0 },
            "category": {
              "enum": ["lodging", "food", "transport", "activities", "shopping", "other"],
              "description": "Optional spend category, used for the cost chip's icon (and, later, a per-category breakdown)"
            }
          }
        },
        "warning": { "$ref": "#/$defs/localized" },
        "note": { "$ref": "#/$defs/localized" },
        "coords": {
          "type": "object",
          "description": "Geocoded lat/lon for the block's own destination (not route waypoints); used for map pins",
          "required": ["lat", "lon"],
          "additionalProperties": false,
          "properties": {
            "lat": { "type": "number" },
            "lon": { "type": "number" }
          }
        },
        "waypoints": {
          "description": "Intermediate stops merged into the day-route URL and stop list",
          "type": "array",
          "items": {
            "type": "object",
            "required": ["query", "name"],
            "additionalProperties": false,
            "properties": {
              "query": { "type": "string", "description": "URL-encoded Google Maps place query" },
              "name": { "$ref": "#/$defs/localized" }
            }
          }
        },
        "photoSpots": {
          "type": "array",
          "items": {
            "type": "object",
            "required": ["name", "mapsUrl"],
            "additionalProperties": false,
            "properties": {
              "name": {
                "description": "Localized like other trip-content fields; a plain string is also accepted for back-compat with trips stored before this field was localized.",
                "oneOf": [{ "$ref": "#/$defs/localized" }, { "type": "string" }]
              },
              "mapsUrl": { "type": "string", "format": "uri", "pattern": "^https?://" },
              "wiki": { "type": "string", "description": "Wikipedia page title for thumbnail lookup" },
              "fallbackImg": { "type": "string", "format": "uri", "pattern": "^https?://" }
            }
          }
        },
        "diff": {
          "description": "Annotation vs the other plan, rendered only on plans with diffLabels",
          "type": "object",
          "required": ["kind", "reason"],
          "additionalProperties": false,
          "properties": {
            "kind": { "enum": ["added", "changed", "kept"] },
            "reason": { "$ref": "#/$defs/localized" }
          }
        },
        "checklist": {
          "description": "Packing/pre-trip checklist rendered as a checkbox list with a done/total progress count (Phase 6 item 2, Tripsy pattern)",
          "type": "object",
          "required": ["title", "items"],
          "additionalProperties": false,
          "properties": {
            "title": { "$ref": "#/$defs/localized" },
            "items": {
              "type": "array",
              "minItems": 1,
              "items": {
                "type": "object",
                "required": ["text", "done"],
                "additionalProperties": false,
                "properties": {
                  "text": { "$ref": "#/$defs/localized" },
                  "done": { "type": "boolean" }
                }
              }
            }
          }
        },
        "guide": {
          "description": "Optional per-stop reading guide, shown in a full-screen overlay from a small (i) button on the block title row. Every field is optional.",
          "type": "object",
          "additionalProperties": false,
          "properties": {
            "why": {
              "$ref": "#/$defs/localized",
              "description": "One or two sentences on why this stop matters"
            },
            "before": {
              "$ref": "#/$defs/localized",
              "description": "Practical must-knows before going in"
            },
            "dontMiss": {
              "description": "Items in walking order",
              "type": "array",
              "items": {
                "type": "object",
                "required": ["name", "text"],
                "additionalProperties": false,
                "properties": {
                  "name": { "$ref": "#/$defs/localized" },
                  "text": { "$ref": "#/$defs/localized" },
                  "image": { "$ref": "#/$defs/guideImage" }
                }
              }
            },
            "story": {
              "$ref": "#/$defs/localized",
              "description": "Brief history and context, several short paragraphs (\\n\\n separated)"
            },
            "closer": {
              "$ref": "#/$defs/localized",
              "description": "Details most people walk past"
            },
            "image": { "$ref": "#/$defs/guideImage" }
          }
        }
      }
    }
  }
}
